<?xml version="1.0" encoding="UTF-8"?>
<!ELEMENT employees (employee)+>
<!ELEMENT employee (id,firstName,lastName,income)>
<!ELEMENT id (#PCDATA)>
<!ELEMENT firstName (#PCDATA)>
<!ELEMENT lastName (#PCDATA)>
<!ELEMENT income (#PCDATA)>